<?xml version="1.0" encoding="UTF-8"?>
<i:DesignSpace id="structural" mapping="structuralSpaceMapping.xml" xmlns:i="http://TheInPUT.org/DesignSpace"
	xmlns:xsi="http://www.w3.org/2001/XMLSchema-instance"
	xsi:schemaLocation="http://TheInPUT.org/DesignSpace http://theinput.org/DesignSpace.xsd ">
	<i:SParam id="SomeStructural">
		<i:SChoice id="FirstChoice" />
		<i:SChoice id="SecondChoice" />
		<i:SChoice id="ThirdChoice" />
	</i:SParam>
	
	<i:SParam id="SomeStructuralParent" fixed="YetAnotherThirdChoice">
		<i:NParam id="SomeSharedPrimitiveSub" type="integer" fixed="3"/>
		<i:NParam id="AnotherSharedPrimitiveSub" type="long" fixed="30"/>
		<i:SChoice id="YetAnotherFirstChoice" />
		<i:SChoice id="YetAnotherSecondChoice" />
		<i:SChoice id="YetAnotherThirdChoice">
			<i:NParam id="SomeChoiceSpecificPrimitiveSub" type="float" />
		</i:SChoice>
		<i:SParam id="SomeSharedStructuralSub" type="String"/>
	</i:SParam>
</i:DesignSpace>