<?xml version="1.0" encoding="UTF-8"?>
<i:DesignSpace id="spot" xmlns:i="http://TheInPUT.org/DesignSpace"
	xmlns:xsi="http://www.w3.org/2001/XMLSchema-instance"
	xsi:schemaLocation="http://TheInPUT.org/DesignSpace http://TheInput.org/DesignSpace.xsd ">
	<i:NParam id="spot.seed" type="long" />
	<i:NParam id="alg.seed" type="long" />
	<i:SParam id="init.design.func" type="String">
		<i:SChoice id="spotCreateDesignLhd" />
		<i:SChoice id="spotCreateDesignLhs" />
		<i:SChoice id="spotCreateDesignBasicDoe" />
		<i:SChoice id="spotCreateDesignDoeR3" />
		<i:SChoice id="spotCreateDesignFrF2" />
	</i:SParam>
	<i:NParam id="init.design.size" type="integer" inclMin="1" />
	<i:NParam id="init.design.retries" type="integer" inclMin="1" />
	<i:NParam id="init.design.repeats" type="integer" inclMin="1" />
	<i:NParam id="seq.design.size" type="integer" inclMin="1" />
	<i:NParam id="seq.design.retries" type="integer" inclMin="1" />
	<i:NParam id="seq.design.oldBest.size" type="integer" inclMin="0" />
	<i:NParam id="seq.design.new.size" type="integer" inclMin="1" />
	<i:NParam id="seq.design.maxRepeats" type="integer" inclMin="1" />
	<i:SParam id="seq.design.increase.func" type="String">
		<i:SChoice id="spotSeqDesignIncreasePlusOne" />
	</i:SParam>
	<i:SParam id="seq.design.func" type="String">
		<i:SChoice id="spotCreateDesignLhd" />
		<i:SChoice id="spotCreateDesignLhs" />
		<i:SChoice id="spotCreateDesignBasicDoe" />
		<i:SChoice id="spotCreateDesignDoeR3" />
		<i:SChoice id="spotCreateDesignFrF2" />
	</i:SParam>
	<i:SParam id="seq.predictionModel.func" type="String">
		<i:SChoice id="spotPredictDice" />
		<i:SChoice id="spotPredictEarth" />
		<i:SChoice id="spotPredictForrester" />
		<i:SChoice id="spotPredictGausspr" />
		<i:SChoice id="spotPredictDice" />
		<i:SChoice id="spotPredictKrig" />
		<i:SChoice id="spotPredictKsvm" />
		<i:SChoice id="spotPredictLm" />
		<i:SChoice id="spotPredictLmOptim" />
		<i:SChoice id="spotPredictMlegp" />
		<i:SChoice id="spotPredictOptMulti" />
		<i:SChoice id="spotPredictPsvm" />
		<i:SChoice id="spotPredictQrnn" />
		<i:SChoice id="spotPredictRandomForest" />
		<i:SChoice id="spotPredictRandomForestMlegp" />
		<i:SChoice id="spotPredictMlegp" />
		<i:SChoice id="spotPredictTgp" />
		<i:SChoice id="spotPredictTree" />
	</i:SParam>
	<i:SParam id="seq.merge.func" type="String">
		<i:SChoice id="mean" />
		<i:SChoice id="median" />
	</i:SParam>
	<i:SParam id="seq.transformation.func" type="String">
		<i:SChoice id="identity" />
		<i:SChoice id="log" />
		<i:SChoice id="inverse" /> <!-- for max problems! -->
	</i:SParam>
	<i:NParam id="seq.useAdaptiveRoi" type="boolean" />
	<i:NParam id="spot.ocba" type="boolean" />
<!-- 	<i:SParam id="report.func" type="String"> -->
<!-- 		<i:SChoice id="spotReportDefault"/> -->
<!-- 		<i:SChoice id="spotReport3d" /> -->
<!-- 		<i:SChoice id="" /> -->
<!-- 		<i:SChoice id="spotReportContour" /> -->
<!-- 		<i:SChoice id="spotReportMetaDefault" /> -->
<!-- 	</i:SParam> -->
	<i:NParam id="report.io.pdf" type="boolean" />
	<i:NParam id="spot.fileMode" type="boolean"/>
	<!-- <i:SParam id="seq.predictionOpt.func" type="String"> -->
	<!-- <i:SChoice id="spotCreateDesignLhs"/> -->
	<!-- </i:SParam> -->
		<!-- Extra setup for input -->
	<i:SParam id="spot.folder" type="String"/>
	<i:SParam id="alg.id" type="String"/>
</i:DesignSpace>