<?xml version="1.0" encoding="UTF-8"?>
<i:DesignSpace id="combined" mapping="combinedSpaceMapping.xml" xmlns:i="http://TheInPUT.org/DesignSpace"
	xmlns:xsi="http://www.w3.org/2001/XMLSchema-instance"
	xsi:schemaLocation="http://TheInPUT.org/DesignSpace http://theinput.org/DesignSpace.xsd ">

	<i:SParam id="SomeStructuralParent">
		<i:NParam id="SomeSharedPrimitiveSub" type="integer" fixed="3"/>
		<i:SChoice id="YetAnotherFirstChoice" />
		<i:SChoice id="YetAnotherSecondChoice" />
		<i:SChoice id="YetAnotherThirdChoice">
			<i:NParam id="SomeChoiceSpecificPrimitiveSub" type="float"/>
		</i:SChoice>
	</i:SParam>
		<i:SParam id="AnotherStructural">
		<i:SChoice id="AnotherFirstChoice" />
	</i:SParam>
		
	<i:SParam type="[3]" id="SomeComplexStructural" fixed="SecondChoice ...">
		<i:SChoice id="FirstChoice">
			<i:NParam id="A" type="float"/>
		</i:SChoice>
		<i:SChoice id="SecondChoice" />
	</i:SParam>
</i:DesignSpace>